body,clusters_0,sentiment_positive_score,sentiment_negative_score,sentiment_combined_score,sentiment_summary,published_date,post_type,total_engagement,comments,shares,likes,author_gender,followers
"Yet its not what I want to do, the wages aren't great and there are no prospects. I have the increasing feeling that my career is something the old me picked, I'm not sure it's what I want to do, I feel stuck in it and I'm not sure what to do about it. 4/5",Income Tax,3.075443762,2.65518793,-0.199639822,neutral,"Nov 10, 2021",Replies,0,0,0,0,Female,1199
"What a surprise  the Johnson tax increases will hit the vulnerable, the low paid, Black & Asian workers the hardest of all. While the wealthiest will gain as those in need are forced to sell their homes As Bevan said 'tories are lower than vermin'",Low Income Families,4.148538695,2.992244175,-0.019841106,neutral,"Sep 9, 2021",Reposts,0,0,0,0,Female,1183
", , , Except paying state pension to (mortgage free 30+yrs NI payer) 6o yr old will often be cheaper than paying UC to a 20/30 something needing to rent/buy a family home. Lower retirement will make way for younger employees. Not perfect  but one solution that would contribute.",State Pension,4.148538695,1.781499541,0.498727112,positive,"Feb 13, 2021",Replies,0,0,0,0,Male,1181
The Mental Health Foundation  “Many households will face a financial cliff edge unless urgent action is taken on debt. The poorest households have highest debt to income ratio”. Make a stand in Liverpool on 7th August against the debt we’ve been forced into.,Mental Health,2.23607233,6.668739675,-1.439283575,negative,"Jul 15, 2021",Reposts,0,0,0,0,Male,1164
"The report also noted that increased unpaid care & domestic work, loss of paid work & increased violence during COVID19 has coincided with worsened levels of stress & anxiety amongst women. CEDAW enshrined into UK law would put greater legal emphasis on women’s health rights. ,",Mental Health,2.478469122,4.933343734,-1.034949511,negative,"Dec 12, 2020",Reposts,0,0,0,0,Female,1129
"Plus lack of proper financial support for people with disabilities, low paid work, poor access to cheapee food shopping options etc, etc...",Mental Health,2.981429773,6.49893184,-1.125808446,negative,"Dec 28, 2020",Replies,0,0,0,0,Unknown,1116
", ""public consultation to find out how much householders are willing to pay, as the local authority continues to grapple with the cost of the pandemic."" What affects willingness to pay? Transparency, value for money, overpaid consultants, Mayor's big pay rise? 1/2",Mental Health,3.111404021,1.153996424,0.645269419,neutral,"Nov 19, 2020",Replies,4,1,2,1,Female,1096
", , they know how to influence these people. The Farages come in and tell the people who feel disadvantaged because of poor education, wages, lack of career prospects & no affordable housing to blame the left, minorities & more without real or substantial resolutions. They are sith",Wage Growth,1.734928385,4.720460696,-1.347513854,negative,"Dec 6, 2020",Replies,0,0,0,0,Unknown,1081
"When poor ppl get married they lose most of their social net benefits. They *should* be able to survive as a duo but the way wages been stagnant… they can’t. And w/o support (SNAP, Section 8, etc) they can’t make it. So folks don’t get married",Social Care,3.699580745,1.99482945,0.271087353,neutral,"Aug 2, 2021",Reposts,0,0,0,0,Female,1067
", Not least because grant income and citations are incredibly poor proxies for someone's value/contribution to a university. Obviously they completely ignore *teaching*. But they don't even encapsulate scientific output well. And are highly skewed to favour of senior academics.",Income Tax,5.246379885,2.821828917,0.273579476,neutral,"Jan 22, 2021",Replies,0,0,0,0,Male,1063
", A large % of the population are on the pigs back. Working from home. Paid 80% of income to do nothing. Budget won’t start to hit for 1 2 years. Covid has hidden job losses. Public expenditure awaiting cuts. Rising interest rates will increase national debt. Things will change.",National Insurance,5.501424105,1.538661899,0.927520255,positive,"Mar 4, 2021",Replies,0,0,0,0,Female,1057
"Families are facing an energy crisis, shortages and price rises because of this Government’s poor decisions and lack of planning. Rather than real wage growth, working people are being hammered by tax hikes and cuts to Universal Credit.",Government Support,1.846394278,5.643657835,-1.463871299,negative,"Oct 12, 2021",Reposts,0,0,0,0,Unknown,1051
"headspinning to see Tories on here talk about the unprecedented wage squeeze of the last decade or so like it was nothing to do with them, and using it as an excuse to deny NHS workers a better pay rise. They truly are the masters of dissembling and allround bullshit",Poor Pay,3.243318049,3.453340614,-0.409318752,negative,"Mar 7, 2021",Reposts,0,0,0,0,Unknown,958
"Joe Biden’s BuildBackBetter bill is the bare minimum America needs to do to ease poverty, make health care & education more accessible to lowincome Americans & combat climate change. It’s an indictment of America’s broken politics that the bill should be controversial. F24",Cost of Living,3.183324539,3.298409579,-0.382087893,negative,"Oct 5, 2021",Reposts,0,0,0,0,Female,948
", Is France such a poor country that it can not fund its own responsibilities? We pay them to defend a border that they do not defend and now they want us to fund a French company!",Poor People,2.981429773,3.687661312,-0.559163082,negative,"Apr 7, 2021",Reposts,0,0,0,0,Female,941
", Need to pay people better, its that simple. Weve had years of low wage economy fuelling our desire for often low cost food. Scotland back in EU would help too obviously",State Pension,5.140732137,2.208222872,0.498433856,positive,"Jul 21, 2021",Replies,0,0,0,0,Male,867
"3. This life insurance / pension / social security category. I don't really understand how these work in the US, to be honest. But they don't sound frivolous to me, they're expensive, and costs are rising way faster than income. ,",National Insurance,3.318040729,4.99383285,-0.755402844,negative,"Sep 9, 2021",Replies,0,0,0,0,Male,792
", Boris Johnson: Boris Johnson & Rishi Sunak  Don't cut Universal Credit  Sign the Petition! £Millions handed to Tory Cronies for fake PPE contracts  but the poorest will pay with £20 cut in Universal Credit from April! ToryCorruption! , via ,",Government Support,4.733257255,4.703048196,-0.340170838,neutral,"Jan 17, 2021",Reposts,0,0,0,0,Unknown,777
", I'm sure you're a good cat dad. I agree with you about paid surrogacy. It's always the poorest women in the world who end up doing it because of lack of choice  same reason poorer women end up in prostitution, too. With so many kids needing adopting it's horribly selfish.",Leaseholding,3.111404021,3.226489061,-0.38289408,negative,"Aug 10, 2021",Replies,0,0,0,0,Female,766
", , This is what a poor board does, allows rumours to spread and build up resentment due to no communication to the support. They are as much to blame as NL for the protests yesterday. Support pay £600 for a season ticket donation with no access to Celtic Park.",Government Support,3.55589031,3.728513508,-0.39397775,negative,"Nov 30, 2020",Replies,0,0,0,0,Male,759
", With many still in their Brexit trance, Sunak payingoff the Tory shires, no policy opposition and the BBC total bad news blackout, sadly, the local election results are a foregone conclusion.",State Pension,3.019653497,4.344525226,-0.710347985,negative,"May 1, 2021",Replies,0,0,0,0,Male,736
", , , There has been plenty of research done on this, resulting in zero evidence that any wages have ever been suppressed. Poor wages are due to poor employers, not skilled people taking jobs that UK citizens largely do not want to do as the current situation so clearly shows.",Poor Pay,2.765692463,3.3292219,-0.532021161,negative,"Jul 25, 2021",Replies,0,0,0,0,Unknown,727
", They got their pay rise this should be getting lifted now. Be clear soon so nothing for Sarwar to moan about. No doubt he will find something else for SNP bad claim. Talks to wee rat Ross for ideas. SaltireSunday YesScots",Leaseholding,2.547777894,2.346537499,-0.264292862,neutral,"Oct 31, 2021",Replies,0,0,0,0,Unknown,697
", , Interesting. Always the poorest who suffer from fines. There was a guy who lived above the pig once who was constantly getting parking fines but said it was better than getting out of bed in the morning to pay. Just wasn’t bothered by it at all.",Leaseholding,5.035782849,3.533156595,0.007803714,neutral,"Nov 30, 2020",Replies,0,0,0,0,Female,674
", , , Exactly standards are already poor yet they complain and expect a rise that's higher than the national average for a political stunt. When the real question should be if you want a pay increase of that size how do we ensure our standards improve",State Pension,4.162028338,2.172262613,0.303659643,neutral,"Nov 1, 2021",Replies,0,0,0,0,Male,655
", , , If paying a living wage to drivers,veg pickers etc, means a slight rise in prices,so be it. Let's face it, supermarkets, where most people shop, make huge profits & can assimilate some price rises.Their competetive approach would suggest they will be loathe to pass on increases.",Pay Rises,2.517891424,1.766578297,0.007803714,neutral,"Oct 3, 2021",Replies,0,0,0,0,Female,654
"@_DylanHamilton_ The people missing out here are probably people on low incomes, who can't afford to pay the inflated prices to go on holiday in the UK this year, since demand is so high. Not the comfortably middle class who can afford a decent holiday in the UK.",Poor Pay,3.183324539,3.563246406,-0.459319528,negative,"Mar 21, 2021",Replies,0,0,0,0,Female,652
", , , PS My mum was a riding instructor (it's lowpaid) and my dad worked on a maintenance team at Gatwick Airport (if things like the baggage claim belt broke down he'd go fix it and it was: lowpaid). Those salaries combined would struggle to RENT their own place now.",Job,1.277755617,3.769610947,-1.428440275,negative,"Sep 8, 2021",Reposts,0,0,0,0,Unknown,611
"Today, MPs will debate the rotten FireAndRehire tactics that allow bad bosses to bully staff into contracts with worse pay & rights, yet not one Government backbencher has applied to speak. Just shows how much they care about protecting people's livelihoods. EndFireAndRehire ,",Social Care,3.764867197,3.113247642,-0.156527442,neutral,"Apr 27, 2021",Reposts,0,0,0,0,Female,587
", I doubt if the feeling was mutual. You will be forgotten in an instant but the damage you have done to Scotland's poorest people will NEVER be forgotten. Enjoy the luxury of your high salaries but they are not guaranteed to last forever. You shameless excuse for a man",Small Businesses,3.000776785,3.33200916,-0.45127788,negative,"Oct 3, 2021",Replies,0,0,0,0,Female,584
", , I assume he has an accountant who knows all these answers and financial advisors . All those poor uneducated morons who feel sorry for him having to pay tax and obey the law . Who applaud his whining . Do they pay tax ?",Rich People,2.795653285,2.89635015,-0.381959153,negative,"Jul 5, 2021",Replies,0,0,0,0,Unknown,578
"It's Sarah Vine who needs to go back to school. The OPEC heist, inflation and low wages forced miners to strike in the 70s. Heath said; 'Who governs Britain?' The electorate said; 'Not you!' Wilson, Foot & the NUM then settled the strike in weeks. ,",House Prices,1.846394278,5.33499174,-1.407626228,negative,"Aug 8, 2021",Reposts,0,0,0,0,Unknown,572
", , The Roman Senate never spent too much time deliberating whether their gods were real or not. They just satisfied themselves by reminding the plebs that they were bad citizens who'd piss Jupiter off for sure if they didn't pay their taxes promptly.",Government Support,5.549371117,1.490714887,0.967855224,positive,"Oct 18, 2021",Replies,0,0,0,0,Male,554
", , , Oh I have a licence I like David Attenborough . I can't stand that Pointless programme mind you it's well named as far as I'm concerned . Although my poor old father only has half a eye , I think it's bad he has to pay for a licence.",Government Support,1.895733531,4.838064652,-1.283482514,negative,"Aug 5, 2021",Replies,0,0,0,0,Unknown,540
", Imagine, poor Shamima isn't welcome in Britian, OR the EU! How the union has failed this poor sweet innocent girl. Who will pay her benefits and home her now?",State Pension,5.875122442,1.318853056,1.147390849,positive,"Feb 26, 2021",Replies,0,0,0,0,Male,535
"Forget being outraged at the Octoberlockdown and instead be concerned with the social care overhaul that this inept, incompetent and unfair government are planning. Taxing the workers. Making cost of living pay rises defunct. Protecting the dead and rich. fuckthetories.",Social Care,1.577207623,6.999104193,-1.836699802,negative,"Sep 7, 2021",Reposts,0,0,0,0,Unknown,528
", , and deserve more. As do delivery drivers, police and many others. Sick and tired of this NHS. Look at the amount paid out for poor care and death. Lived in many EU countries and NHS bottom of list. pockets of excellence not shared throughout country.",Statutory Sick Pay,3.55589031,3.769610947,-0.404939919,negative,"Mar 6, 2021",Replies,0,0,0,0,Female,516
", They are extremely reliant on low education voters who are tired of the poor pay. College educated voters hate them, so they really struggle outside of those workers plus retired",Poor Pay,1.318853056,4.892246295,-1.657462691,negative,"Oct 1, 2021",Replies,0,0,0,0,Male,507
", The majority of the electorate is happy to pay a little more tax so that the poorest people in society don't starve and/or freeze to death or face a choice between their health and their job, but they would be happier if billionaires like Sunak paid their fair share as well.",Job,5.543310798,1.153996424,1.22278728,positive,"Jan 18, 2021",Reposts,0,0,0,0,Unknown,497
"cant believe this has to be said but...removing financial barriers to education OBVIOUSLY benefits the working class+ should OBVIOUSLY come as part of broader economic reforms, increased welfare payments+benefits that mean kids arent trapped helping pay bills. this is basic stuff",Cost of Living,4.197988597,1.118036165,0.976458193,positive,"Jan 29, 2021",Reposts,0,0,0,0,Male,491
"Good piece. Brexit has exposed, but does not solve, fundamental problems in our economic model: low wages & poor conditions, driving an ""unsustainable cheapness"" on which other lowincome households depend. An economy that rests on & perpetuates inequality ,",Low Income Families,1.538661899,5.851461714,-1.682351944,negative,"Aug 25, 2021",Reposts,0,0,0,0,Male,483
"Casual contracts and the prospect of impoverishment in retirement are big buzzkills, too. Being told  by constant real wage cuts  that our work is worthless, while bosses award themselves huge pay packets, is also a buzzkill. Student debt, poor housing... so many buzzkills",Wage Growth,3.638085188,1.277755617,0.699778791,positive,"Nov 5, 2021",Reposts,0,0,0,0,Unknown,467
", The issue of low pay for nursery care is harder, but partly stems from how expensive the costs are (ie it's already barely affordable, so not much room to raise prices & thus wages), though doubt this is half the total problem, as all care work is relatively lowpaid employment.",House Prices,1.734928385,3.510877028,-1.051473326,negative,"Oct 5, 2021",Replies,0,0,0,0,Male,453
", When are the British public going to wake up to the fact Brexit is a disaster? Until they do they will be putting up with lower rates of living. Vaccination rhetoric is used so no one will notice how bad things are. All because the rich did not want to pay tax on off shore money.",Rich People,1.277755617,5.390734273,-1.78615008,negative,"Jul 16, 2021",Replies,0,0,0,0,Unknown,449
", , , , Atrocious policy. No fair negotiation with this type of blackmail over workers heads. I will always support the working mans right to strike over unfair pay and conditions of service. I hope you will get the solidarity you need and TUC support. ( and I have a BG service contract)",Poor Pay,4.32382721,3.490276493,-0.13241361,neutral,"Jan 7, 2021",Reposts,0,0,0,0,Unknown,446
 Lost job due to covid  Found lower paying job to try and make ends meet  Bills started to fall behind  Got Covid19  Currently quarantined and can’t work  And just received a 30 day notice to vacate my apartment LORD I JUST CAN’T 😭😭😭 Y’all I need help 🥺,Job,1.846394278,5.33499174,-1.407626228,negative,"Dec 10, 2020",Reposts,0,0,0,0,Unknown,445
", , , , , Wages suppressed for too long, hours too long to make a good wage, replaced by cheap low quality labour, just like all sectors. I know companies that will NOT employ EU nationals, as too much damage been caused over the years etc by cowboys, but then, look at tradespeople too",Poor Pay,2.765692463,2.931919626,-0.404939919,negative,"Aug 28, 2021",Replies,0,0,0,0,Unknown,445
"⚖️ , I. Stephanie Boyce writes that civil LegalAid is being eroded and with it our ability to access rights. A generation of cuts and stagnant rates of pay have pushed many firms to the brink of bankruptcy , ,",Mental Health,4.244432719,2.992244175,0.00301092,neutral,"Sep 27, 2021",Reposts,0,0,0,0,Female,440
", , , , It will take years and a reorganisation of haulage. Nobody is joining the business because the wages, hours and conditions are appalling. Knock on effect will be long term shortages and increased costs leading to inflation.",Poor Pay,4.148538695,4.349932426,-0.39397775,negative,"Aug 28, 2021",Replies,0,0,0,0,Male,430
"On a call regarding ‘Fire and Rehire’. Fire and Rehire is immoral. It should be illegal. It attacks wages, it spreads insecurity and it benefits bad bosses. FireAndRehire tradeunion , , , ,",Poor Pay,1.538661899,5.75556769,-1.665828129,negative,"Apr 13, 2021",Reposts,0,0,0,0,Unknown,425
"Alliance Boots alone, who profit from huge NHS contracts, have avoided around £1.2bn tax since 2007. Overall corporate tax abuse amounts to some £69.9bn EVERY YEAR. Instead of making them pay, this Govt is taxing the poor. It's time to TaxTheRich ,",Government Support,1.538661899,4.44582645,-1.407626228,negative,"Sep 8, 2021",Reposts,0,0,0,0,Female,424
"Why should a hedge fund manager pay a lower rate of tax than a nurse? That's the question begged by our current system of capital gains tax. Even Thatcher agreed. Action to tackle this would be a political no brainer. ,",Low Income Families,3.14736428,3.226489061,-0.371402792,negative,"Nov 12, 2020",Reposts,0,0,0,0,Female,407
", , , , , , Of course it didn’t pay off. What a strange way to look at it. The bad writing just means the stories weren’t told as well as they could have been. That’s one of the oddest comments I’ve ever read. “The bad writing paid off”. Just truly bizarre.",Leaseholding,1.551054707,3.879957786,-1.263462708,negative,"Jul 20, 2021",Replies,0,0,0,0,Male,384
", Which is why tax should stay low & uncomplicated enough that it’s not worth paying a tax expert more than the tax you’re paying 🤷🏽‍♂️",Government Support,2.307992848,2.672249311,-0.493115897,negative,"Oct 4, 2021",Replies,0,0,0,0,Male,377
", People are falling below poverty line every day. Salary is stagnant or non existent but bills are rising,How much can we squeeze the average person.Even if u give me NPower or Tradermoni, it doesn't make any difference. My take home pay cant take me home. People are dying daily",Poor Pay,1.318853056,5.015538612,-1.682351944,negative,"Jan 16, 2021",Replies,0,0,0,0,Unknown,369
"Money runs and controls everything in this country. Even the constitution could be interpreted, twisted and tweaked to your favour if you pay enough money. The result of a bad value system, weak institutions, and incompetence in all arms and levels of government.",Wage Growth,2.797657138,3.837045127,-0.662493832,negative,"Jul 30, 2021",Reposts,0,0,0,0,Male,366
"The “obesity crisis” has absolutely nothing to do with “bad foods” being cheap and everything to do with poverty, poor work/life balance, long shifts and shit wages. Taking more money off people is not going to do anything and neither is taxing accessible foods.",Long Hours,2.938559021,4.933343734,-0.864671259,negative,"Jul 15, 2021",Reposts,0,0,0,0,Female,365
", , , , Everyone is capable of ingenuity. Socialism stifles it by not rewarding it. UBI or negative income tax could just do the opposite as they give saftey nets to the poorest, free people up to work on meaningful things while keeping rewards for value added that capitalism provides",Income Tax,4.569539677,3.093811387,0.043435093,neutral,"Aug 8, 2021",Replies,0,0,0,0,Unknown,358
"The rising costs of living, high rent, lack of wage increases and the wait for Universal Credit are some of the main reasons for most people in the UK falling below the poverty line, leading to food bank use, not because of their spending habits. ,",Government Support,2.478469122,3.728513508,-0.754942141,negative,"Apr 28, 2021",Reposts,0,0,0,0,Unknown,345
"Angela Rayner: ""Under the Conservatives we have a broken economic model defined by insecure work, low wages and inwork poverty, and a lack of opportunity for people who want to get on and find good work to support themselves and their families."" SocialismFixesThose",Leaseholding,3.596987749,5.182587723,-0.711781323,negative,"Jul 26, 2021",Reposts,0,0,0,0,Unknown,344
"For the last 48 years real wages for the working class in this country have been stagnant while the very rich have gotten much richer. Today, the top 1% own more wealth than the bottom 92%. Our job is to defeat oligarchy and create an economy that works for all, not just the few.",Low Income Families,2.478469122,2.564780721,-0.380805496,negative,"Jun 3, 2021",Reposts,0,0,0,0,Male,344
", , , I'd suggest most of the wealth they create is kept for themselves and the disparity between the highest paid and the lowest is to great and cannot be justified. That people cannot live on 'minimum' wage while the wealthy avoid tax is a national embarrassment.",National Insurance,2.843600297,4.64071708,-0.836371528,negative,"Dec 9, 2020",Replies,0,0,0,0,Female,331
"Gross Income Inequalities Shame Britain: shoddy packed lunches for children entitled to free meals  almost one child in five  reveal starkly the chasm between lowpaid households and those within the financial stratosphere ,",Government Support,1.538661899,5.75556769,-1.665828129,negative,"Jan 13, 2021",Reposts,0,0,0,0,Unknown,325
", Notice he doesn't suggest a meaningful pay rise.what a cheek from the man who run down the NHS budgets and staffing levels.",Poor Pay,2.981429773,6.594825864,-1.140455997,negative,"Feb 10, 2021",Replies,0,0,0,0,Male,320
", , , , credits/universal credit. The wage top up is not the best system 2b fair as it does block wage growth. On the plus side, it means even those in low paid jobs can afford 2 live. No system is perfect but not having universal healthcare is just madness in the richest country on 🌍",Government Support,4.502804693,3.490618971,-0.091952199,neutral,"Dec 19, 2020",Replies,0,0,0,0,Male,311
", , , , There’s a lack of connection between home and environment. Homes without accessible and natural landscapes are just future slums. Short term solutions for poor strategic and financial planning. As usual, the poorest pay.",Low Income Families,3.077323797,6.49893184,-1.094151099,negative,"Oct 1, 2021",Replies,0,0,0,0,Unknown,304
", , £30000 plus a year Not a bad wage for sleeping with him. Ladies send you cv to , 10 Downing St London sw1 Mark envelope private.",Public Sector Pay,6.039306994,4.615985696,-0.077809751,neutral,"Mar 29, 2021",Replies,0,0,0,0,Male,302
"By 'fortunate"" enough you mean the entire Civil Service in Canada who were immediately declared immune from Covid fiscal consequences & collected their full pay with benefits & raises throughout while the lower working Private sector class suffered all the effects, yup party time",Public Sector Pay,2.31514512,0.839270127,0.668121444,neutral,"Jul 18, 2021",Reposts,0,0,0,0,Unknown,292
", Just to be clear, the private companies eg G4S, will be highly paid. The poor bloody workers on the front line will only receive a pittance in wages. More cash handouts for the tory mafia. Disgraceful. The most corrupt, useless, incompetent and deceitful pm and government EVER",Poor Pay,2.262839288,5.465683905,-1.2284425,negative,"Jul 27, 2021",Replies,0,0,0,0,Male,290
", , , My lower back was bad too, luckily can go back to the office. Employers should pay for the setup though. I got a monitor from them in case I have to go back home to allow other to come in when it's mandatory again (at social distance reduced desks, sigh).",Low Income Families,4.756603815,1.277755617,0.967855224,positive,"May 17, 2021",Replies,0,0,0,0,Unknown,289
I’m at the top of my band so therefore have had no pay rise for 3 years. I won’t get a pay rise. Despite being responsible and accountable for numerous skills that I could boggle your mind by explaining...,Wage Growth,2.546659632,3.482108821,-0.659429132,negative,"Mar 5, 2021",Replies,0,0,0,0,Female,287
"Payroll deduction with your credit union is one of the easiest ways for your employees to save small amounts directly from their pay. Poor financial wellbeing affects productivity and leads to increased absenteeism. Talk to us today , about this free staff benefit.",Public Sector Pay,6.659245341,1.846394278,0.936197877,positive,"Dec 10, 2020",Reposts,0,0,0,0,Unknown,285
"Today's budget brings both positives and negatives  the UC taper change, rise in the living wage and support for renters are good steps, but many lowerincome households will continue to struggle with the burden of pandemic debt Read more: , ,",Low Income Families,4.148538695,4.349932426,-0.39397775,negative,"Oct 28, 2021",Reposts,0,0,0,0,Male,264
