body,clusters_0,sentiment_positive_score,sentiment_negative_score,sentiment_combined_score,sentiment_summary,published_date,post_type,total_engagement,comments,shares,likes,author_gender,followers
"She does not know and she does not care. Many low paid workers will be paying higher national insurance and lose £20 per week from universal credit as the cost of living crisis hits home. Folk being driven into poverty as a political choice by , and her Government.",Government Support,3.14736428,4.617472854,-0.729855778,negative,"Oct 3, 2021",Original,20,1,6,13,Unknown,551
"Disingenuous spin from government... ""Nurses want better staffing rather than a pay rise"", says care minister .@Helen_Whately... BUT FIRST you need to ATTRACT & RETAIN nursing staff! , , , SafeStaffingSavesLives FairPayforNursing ,",Social Care,4.715506376,1.277755617,0.959177602,positive,"Mar 26, 2021",Original,6,0,2,4,Female,522
"So NHS workers now resent the British public for showing support in clapping last May as it hasn’t bought them a good enough pay rise! In a pandemic, where the government is struggling and people are losing their jobs daily. That’s nice of them. A rise is a rise. ungrateful",Poor Pay,2.489123217,2.581191248,-0.38289408,negative,"Mar 5, 2021",Original,4,0,0,4,Male,406
"BBC News  The tax fraud merrygoround that cost billions , Legal loopholes and corrupt tax laws made by those who benefit from the rules ensures that crime pays and whilst the poor suffer.",Cost of Living,2.478469122,6.220368838,-1.266761714,negative,"Oct 21, 2021",Original,0,0,0,0,Male,291
"In a pandemic the government begin to pass a bill that takes away peoples right to a peaceful protest, gives healthcare staff a miserable pay rise and plans to increase its nuclear weapons essentially inciting protests. What kind of government does that? The Tory gov that’s who",Public Sector Pay,3.55589031,4.974441173,-0.682281157,negative,"Mar 28, 2021",Original,5,1,0,4,Male,134
"Obvs, Virginia Giuffre will win her civil case by default. Prince Andrew isn't going to visit the US to testify. So a 'paper judgement' worth umpteen million dollars, which will never be paid. Maybe it's more important to her to get her story taken seriously. A bad method imho.",Government Support,4.083817502,1.73781009,0.507832871,positive,"Aug 10, 2021",Original,1,1,0,0,Unknown,116
The May local elections are coming along  not that Tories care what public think! However local party activists do not want to be harangued about poor NHS primary care services and terrible pay deal. I sense something must be done.#NHSPay,Social Care,2.546659632,1.912280883,-0.060087747,neutral,"Mar 7, 2021",Original,0,0,0,0,Male,76
"What a lie and a joke. Our NI increase is to give back to the government for paying us furlough. The NHS have worked this way before pandemic, snail pace. I do not want to pay this increase, it’s a scam to put it back into government funding.",Mental Health,5.035782849,3.824561765,-0.071448484,neutral,"Oct 6, 2021",Original,1,0,0,1,Unknown,22
", , I live in an 11+ area. It's a divisive system.Teachers aren't allowed to teach or talk about it so the ""poor"" kids don't benefit from tuition or preparation for a test which is difficult to navigate. It benefits well off kids who's parents pay for tuition in their earlier years.",Government Support,3.638085188,4.031184168,-0.449176265,negative,"Nov 12, 2020",Reposts,0,0,0,0,Male,219130
"People’s incomes are being squeezed by high energy bills, unaffordable rents, and through job losses in regions like mine. To cut support to our poorest communities, many working long hours on low pay, is callous and cruel. The , don’t give a damn about workers. ,",Long Hours,1.863768857,5.743190153,-1.471987717,negative,"Sep 28, 2021",Reposts,0,0,0,0,Unknown,67333
So I welcome this overdue reform. No one likes tax rises. But a 1.25% levy on NI and dividends seems a fair way to spread the load. And it’s a small price to pay for the peace of mind of knowing you won’t have to sell your home should you or loved ones ever need socialcare. 3/,Pay Rises,3.163527469,2.141869422,0.043435093,neutral,"Sep 8, 2021",Reposts,0,0,0,0,Unknown,26218
", I was told a long while ago, that being right doesn't help. We know we are right in lots of things, but we still end up paying the price. We always have and we always will. The poor pay for the mistakes of the rich.",Rich People,3.075443762,3.491325888,-0.473405961,negative,"May 27, 2021",Reposts,0,0,0,0,Unknown,20644
"Educational leaders should be well rewarded  and so should great teachers. The scandal is that it is an one way street  £250k plus salaries the state can never match. Private School Pay List: rise in £100,000 salaries sparks fears of brain drain ,",Poor Pay,3.66761607,2.899954951,-0.111726914,neutral,"Mar 7, 2021",Reposts,0,0,0,0,Unknown,14180
"In politics, once people get a bad impression of you, it can be hard to turn around. Bad impressions stick. But FWIW, paying attention to his public statements in the last week or two, it does feel like there's been a step change in Team Starmer. Recovery is possible.",Public Sector Pay,2.517891424,2.609959456,-0.382486462,negative,"Jul 19, 2021",Reposts,0,0,0,0,Female,14046
"“The way we stop transmission is to get people selfisolated… people in deprived areas & lowpaid jobs have been less likely to be able to afford to selfisolate” Independent Sage’s , says the govt's financial support ""has not been enough"" ,",Poor Pay,5.140732137,1.118036165,1.179048196,positive,"Jan 6, 2021",Reposts,0,0,0,0,Unknown,13531
"We still actually need to wear clothes every day, so not entirely sure what the savings are unless work from home means work naked?! (Please god no). Whilst I’m not paying pret prices, three meals a day are now in the home so food bill has hugely increased. 3/",House Prices,1.118036165,1.336124655,-0.524773244,neutral,"Nov 12, 2020",Replies,0,0,0,0,Male,9167
"🚌 Stagecoach has £millions in the bank but says drivers don't deserve a fair wage. It's on the road to strikes at 18 depots. , warns it to get ready for a relentless campaign to protect our members' pay. Support our drivers by sharing this message. BadBossesBeware ,",Poor Pay,5.549371117,3.187134804,0.207988686,neutral,"Sep 23, 2021",Reposts,0,0,0,0,Unknown,8686
", 2/2 ...milked assiduously. In a period of low growth, the tax charge is grossly unfair. Yes, savings are from gross income, but I have never paid top rate tax, and of course the tax relief on contributions is only deferral of tax anyway. Why has there been so little challenge?",Wage Growth,2.733727789,4.07245564,-0.745153591,negative,"Mar 6, 2021",Replies,0,0,0,0,Male,8628
", , Yes we all love no sick pay, no job security and poor pay and working conditions  IEA TWAT needs to try providing for a family for a year in the gig economy and then try and say we like parting and flexibility. ,",Statutory Sick Pay,5.990248642,1.538661899,1.012646189,positive,"Apr 4, 2021",Reposts,0,0,0,0,Male,8030
"Since the pandemic hit, bosses of huge companies across the UK have tried to fire their workforces and rehire them on poorer pay and contracts. Less pay & fewer rights? Unite have said no! Join us tonight at 7pm & help lead the fight back ✊ , ,",Mental Health,4.244432719,2.992244175,0.00301092,neutral,"Jan 20, 2021",Reposts,0,0,0,0,Unknown,4870
"He does not know and he does not care. Many low paid workers will be paying higher national insurance and lose £20 per week from universal credit as the cost of living crisis hits home. Folk being driven into poverty as a political choice by , and his Government. ,",Government Support,3.14736428,4.617472854,-0.729855778,negative,"Oct 3, 2021",Reposts,0,0,0,0,Female,4569
"While it goes without saying a scheme like this would benefit metropolitan office workers, it would be indispensable for those in precarious, low paid work and especially for low income and single parent families (women are actually more impacted by long commute times than men!)",Low Income Families,3.635651396,2.931919626,-0.131442665,neutral,"Jul 1, 2021",Replies,0,0,0,0,Female,4479
", Ah yes, the same reason some suggest due to the tax increase it is not worth taking a pay rise. When you will still actually end up with more money.",Poor Pay,4.148538695,1.781499541,0.498727112,positive,"Sep 8, 2021",Replies,0,0,0,0,Unknown,3644
", , , Well paid? What planet are you on? Nurses salaries are awful for the work they do. A 1% Rise is a joke when council tax is U.K. 1.6%. Their salaries do not reflect living wage. Lots of staff shortages but I don’t see these people complaining about their lack of job retraining?",Council Tax,3.412320356,5.162382497,-0.760579271,negative,"Mar 5, 2021",Replies,0,0,0,0,Female,3370
", me too I'm self employed but not Ltd but many people I know are and in a similar position. the way I see it is tory tax rises will adversely affect small business's the most just like their tax cuts are of least benefit to those on lower incomes",Low Income Families,3.111404021,1.153996424,0.645269419,neutral,"Feb 25, 2021",Replies,0,0,0,0,Male,3279
", , Terrifying isn’t it. Supposing one is living on a terribly low income and every penny is going on bills/food to survive. Those poor people won’t be able to afford it. My heart sinks, it really does.",Cost of Living,4.797701254,1.277755617,0.976458193,positive,"Sep 19, 2021",Reposts,0,0,0,0,Female,3261
Don't think by throwing a few crumbs to the people they will vote Tory Even the 6.6 % living wage rise is not great as the treasury will claw that back in other ways He's cheated the pensioners abolishing the triple lock and allowed 1000s of illegal asylum seeker to enter the UK,State Pension,4.601504352,3.093811387,0.050405903,neutral,"Oct 27, 2021",Reposts,0,0,0,0,Female,3010
"THREAD: The Covid19 pandemic is fueling child labor in 4 key ways: 1) Unprecedented loss of jobs and income have plunged nearly 90 million people into extreme poverty, increasing pressures on children to work to support their families. ,",Mental Health,1.153996424,4.352636026,-1.674124166,negative,"May 26, 2021",Reposts,0,0,0,0,Female,2758
Do u know how disrespectful it is for a millionaire to be able to sit there and tell you how much someone living on the lowest wage should be able to live off? He wouldnt be able to live on his £80k wage WITH expenses but its the people on the bottom he tells to work with scraps,Cost of Living,1.538661899,3.24946592,-1.094151099,negative,"Aug 12, 2021",Reposts,0,0,0,0,Unknown,2737
"Just as young people are hit by the NI tax hike, govmt looking at lowering the threshold where graduates pay back student loans to £23K  so yet another tax for lowpaid graduates rather than taxing the rich. Apparently to dissuade pple from going to uni. Tories 🤬🤬🤬🤬🤬🤬🤬 ,",Rich People,2.938559021,1.277755617,0.486240627,neutral,"Sep 27, 2021",Reposts,0,0,0,0,Male,2422
"Workers across the country have put their lives on the line during the pandemic, but fire and rehire allows bad bosses to intimidate them into accepting worse pay and conditions. That’s why I'll be backing the Bill to StopFireAndRehire today. ,",Poor Pay,3.469856771,5.219918911,-0.754942141,negative,"Oct 22, 2021",Reposts,0,0,0,0,Male,2233
", , , Aye right Scotland pays our own way!Scotland actually gets more money in exports that England will ever have! So if we're a burden to you let us go, nah thats right poor wee England couldn't pay its own bills and we wouldn't allow you to keep trident at faslane. Either!",Cost of Living,3.075443762,3.491325888,-0.473405961,negative,"Sep 27, 2021",Reposts,0,0,0,0,Male,2177
"People’s incomes are being squeezed by high energy bills, unaffordable rents, and through job losses in regions like mine. To cut support to our poorest communities, many working long hours on low pay, is callous and cruel. The , don’t give a damn about workers.",Long Hours,1.863768857,5.743190153,-1.471987717,negative,"Sep 29, 2021",Reposts,0,0,0,0,Unknown,1963
", Lord my mum is just drained. Teachers want them to be open but to be safe. It’s far more disruptive to have schools opening and closing because staff are ill and bubbles bursting. But provisions for homes with multiple children and low income / poor internet need to be considered",Public Sector Pay,3.14736428,3.298409579,-0.393448631,negative,"Jan 4, 2021",Replies,0,0,0,0,Male,1834
"It is good to highlight this issue & signpost to help , but there is also a need to look at the reasons why people need to borrow from these lenders  incomes are too low on social security/in low paid work  tackle this & you help eradicate the need for this lending ,",Poor Pay,4.196485707,2.992244175,-0.008349818,neutral,"Jun 17, 2021",Reposts,0,0,0,0,Unknown,1457
", , , Not about science it's scheme enable corporates continue exploitation.10% global emissions caused fast fashion synthetics & cotton really bad too destroyed Aral sea & food source. Then WEF PR companies & WWF greenwash. I pay UK seamstress £25 hr corporates exploit labour ? ,",State Pension,1.318853056,4.933343734,-1.665828129,negative,"May 24, 2021",Replies,0,0,0,0,Unknown,1313
"Poor old mick has lost it his jag has lost the edge pushing experimental vaccines proves he is standing on the ledge wild horses wouldn't drag him to a freedom protest true but who with any brain cells would pay to watch a shrew ... ,",Poor Pay,2.132700223,4.352636026,-1.059966348,negative,"Sep 26, 2021",Reposts,0,0,0,0,Male,1309
", NHS has many lower paid staff who do not earn a fantastic wage. Next time you visit a hospital, look beyond nurses and doctors. See the staff that really make the place tick. Without them, NHS would fall apart. Did you applaud them in the summer? And now you attack them.",Public Sector Pay,2.396274244,2.564780721,-0.414531444,negative,"Dec 1, 2020",Replies,0,0,0,0,Unknown,1193
", , Question Time audience member refusing to accept £80,000 salary means he is in top 5% of earners. And his lower paid family and friends agree.",Poor Pay,6.659245341,1.788857864,0.967855224,positive,"Feb 6, 2021",Replies,0,0,0,0,Male,1099
I think it’s fair to say that the pay rise offer is very disappointing to say the least but I feel I need to say it’s not just nurses and whilst I respect enormously the work they do all the support services play a huge part in keeping the hospital running as well,Poor Pay,3.0269297,1.60598027,0.287240885,neutral,"Mar 6, 2021",Reposts,0,0,0,0,Unknown,1082
", Poor UK standards of NHS employment means many nurses and Drs have poor English language skills, so document errors are inevitable, but clinical coding ""errors"" are more likely to be to meet targets, or to increase income. The coding errors, ultimately, benefit the govt.",State Pension,2.797657138,2.931919626,-0.393448631,negative,"Sep 17, 2021",Reposts,0,0,0,0,Unknown,1064
", The biggest insult is the Border force chief was given a pay rise for doing to crap job. While all the British tax payer will suffer for all this spending & keeping all these illegal migrants in luxury..",Job,3.354783942,5.277455326,-0.799630257,negative,"Aug 8, 2021",Reposts,0,0,0,0,Unknown,1021
", , Those on legacy benefits such Income Support & ESA etc never even got the uplift or any extra help, blame put on tech issues then they were ignored. It needs backdating for them. Plus get rid of the so called 'Bedroom tax' it's unfair & leaves many suffering hardships.",Income Tax,2.219748447,4.1302357,-0.967514189,negative,"Oct 6, 2021",Replies,0,0,0,0,Unknown,1018
", , The key reasons for these events are as follows... 1) lack of separation between politics and policing. bias on identity or characteristic too strong atm 2) poor recruitment, pay and selection processes. 3) poor choices based on poor training. We need strong people as police",Low Income Families,2.891547309,2.89635015,-0.348233206,negative,"May 22, 2021",Replies,0,0,0,0,Male,1005
"Radio scotland, naw radio WM sycophants! Why are they continuing with trying to take NS down? How much have these folk been paid to keep the NS baaad narrative going. I wish they got torn into gov in 🏴󠁧󠁢󠁥󠁮󠁧󠁿like this, but that would be asking for fairness, way too much to ask i think!",Government Support,2.765692463,1.99482945,-0.019841106,neutral,"Mar 4, 2021",Reposts,0,0,0,0,Unknown,972
", , , Solution; keep everybody on poverty wages 🙄 if companies want workers, they have to be attractive to work for, yes it's that simple. My dad and brother's wages have been increased by 15%, inflation hasn't risen by 15%; we had this nonsense in 97' on introduction of min wage.",House Prices,5.453477093,2.89635015,0.286228438,neutral,"Aug 8, 2021",Replies,0,0,0,0,Female,919
UGHbad outcome. Time for YET ANOTHER ROUND of calls to your senators. Senate shld slow down the whole infrastructurebill if crypto taxes are truly the only payfor that enables it all. Passing the original bill means pushing a big & fastgrowing industry overseasbad outcome,Income Tax,3.596987749,2.564780721,-0.008349818,neutral,"Aug 8, 2021",Reposts,0,0,0,0,Unknown,835
", , Truly disgusting that innocent people are paying these costs born out of corner cutting, poor regulation and flat out fraudulent activities.",House Prices,3.412320356,5.277455326,-0.78262511,negative,"Feb 24, 2021",Reposts,0,0,0,0,Unknown,801
"(this is why I can't share the outrage about how Amazon workers are treated. For some reason only Amazon gets outrage and it's *common* for lower waged jobs to be this shitty. Sure, better conditions are needed, but it's not Amazon that's the issue. It's late stage capitalism)",Poor Pay,3.354783942,3.47562018,-0.381959153,negative,"Aug 28, 2021",Replies,0,0,0,0,Female,790
"I hope all the low income black people that have diabetes and voted for Biden are happy about his insulin price increase. Heyyy...at least President Trump is not in office, though.",Low Income Families,4.92071002,1.846394278,0.633644544,positive,"Jan 23, 2021",Reposts,0,0,0,0,Unknown,651
", , , , Exactly. You can afford it. The poor in the UK will never afford it. Waiting tables in shut EU restaurants will pay zero. Oh, and I'd rather be served by a native, it isn't exactly culturally enriching chatting to an Irishman about italian cuisine. This is the problem.",Poor People,3.300854463,1.978447759,0.165295196,neutral,"Dec 13, 2020",Replies,0,0,0,0,Male,619
", Glad I gave up when they went up 5p in the budget around 1979 from 67p to 72p for 20. More from health perspective but yes, no wonder those on low incomes who drink and smoke struggle to put food on the table.",Mental Health,4.92071002,1.788857864,0.665301891,positive,"Oct 28, 2021",Replies,0,0,0,0,Unknown,530
"For every billion that Joe Manchin is trying to cut from the Build Back Better plan, there will be some lowwage workers, some families, and some children who are hurt. And, even though I’m Black, the truth is that the people he will hurt the most in raw numbers will be white.",Low Income Families,4.079623957,2.949704363,-0.022273723,neutral,"Oct 6, 2021",Reposts,0,0,0,0,Unknown,486
", Absolute joke of a segment once again. A total of £327 worth of products and thats just for the hair!!!! Can't believe you think we're all rich, Some of us have lost jobs and income and the constant expensive products make us feel poor. thismorning ,",Rich People,2.096739964,2.244183131,-0.414531444,negative,"Jun 30, 2021",Replies,4,0,0,4,Male,470
", , We are facing a sudden cliff edge market correction, following a 17 year gradual change to a economy based on massive supply of foreign labour. This created problems for uk working people poor pay and conditions. A business model wonderful to exploitive employers.not good.",Poor Pay,2.843600297,4.703048196,-0.849713482,negative,"Jul 15, 2021",Replies,0,0,0,0,Male,440
", , , I live in Germany, they have freedom of movement and generally higher wages, also worked in Austria where wages are much higher. Please don't pretend you care about the working conditions for the poor when you've clearly voted against that.",Poor Pay,6.28178567,1.318853056,1.21431823,positive,"Oct 3, 2021",Replies,0,0,0,0,Male,412
", Also, the ""wage growth"" he blurts out is a false measure. The reason the figure for the average wage has gone up is because so many people on low wages lost their jobs! No support from Johnson. Who apart from HGV drivers has had even inflation increase? ,",Poor Pay,1.538661899,6.046352344,-1.71511562,negative,"Oct 2, 2021",Replies,0,0,0,0,Male,407
"Another closure ATU, not safe not effective, abuse, restraint, seclusion , , A broken system of poor pay for staff, lack of training, lack of human kindness and human rights ! This angers us and things have to change !",Public Sector Pay,4.162028338,4.581512595,-0.442600258,negative,"Jul 22, 2021",Reposts,0,0,0,0,Female,399
"The British empire was the result of dutch Jews infiltrating the city of London after Cromwell communist revolution Crazy growth fuelled by the usurious production of infinite credit was payed off by the exploitation of British labour, & natural resource theft",Wage Growth,4.337320963,4.344525226,-0.348233206,negative,"Sep 21, 2021",Reposts,0,0,0,0,Unknown,363
", , Gary tries his hardest not to pay his tax like us poor people have to do, oh and he peddles unhealthy crisps to fat kids. The world is indeed a better place for two faced virtue signalling millionaires like him. 🙄",Poor People,4.054147561,2.244183131,0.244825262,neutral,"Oct 28, 2021",Replies,0,0,0,0,Female,359
", , , Yeah sorry, that was badly phrased.Nursing of course is a skilled, professional job and I didn't mean to imply otherwise They take advantage of nurses as they know people genuinely care about the patient and don't enter the service for the money, so the wages are unnaturally low",Job,2.798659065,2.150992707,-0.083362653,neutral,"Sep 28, 2021",Replies,0,0,0,0,Unknown,356
", If people feel so strongly about this, where does it end? Supporting a gov't to employ taxation against unrealised gains of assets sets an extremely poor precedent If they want fair taxation, the gov't should use inflation by itself printing money. That way everybody pays fairly",House Prices,4.804013674,1.472148581,0.836155207,positive,"Nov 6, 2021",Replies,0,0,0,0,Male,348
"like i always tip waiting staff even bad ones but i don’t feel obliged to because their wages are low, i do it because i know how hard the job is. in america you literally can’t go for a meal without being able to afford to pay the staffs wages too it’s so weird 🥴",Job,3.000776785,3.33200916,-0.45127788,negative,"Nov 6, 2021",Reposts,0,0,0,0,Unknown,339
", I've worked hard for 25 years now. My income will fall next year EVEN IF I get an inflationary pay rise (which hasn't happened in over a decade). My wife has had her payrise for next year already and, you've guessed it, below inflation. How does this budget support our family?",House Prices,4.196485707,4.44582645,-0.404291931,negative,"Oct 28, 2021",Replies,0,0,0,0,Male,325
", , , More like 20 to 30 years. A shock like Brexit to the UK economy takes decades to work through. Most of the old Tories that voted for Brexit will be dead by then and the poor working people of this country will have to pay for the mistakes. Not sure N.Ire. will survive it.",Low Income Families,3.68640845,4.064720513,-0.444265912,negative,"Sep 22, 2021",Replies,0,0,0,0,Male,299
", The problem with the scheme is its disproportionately unfair. Most on furlough now are shop staff and hospitality staff who earn mostly minimum wage as it is, knock that back to 80% and it’s even less.",Minimum Wage Increase,2.168660482,4.388596286,-1.051473326,negative,"Feb 8, 2021",Replies,0,0,0,0,Unknown,296
Haulage companies don't want to increase wages. Which is why they caused the fuel panic to put pressure on the Gov to allow cheap imports.,Poor Pay,2.307992848,4.780702206,-1.074782781,negative,"Sep 26, 2021",Reposts,0,0,0,0,Male,266
"Listen up ,! WE the people, ESPECIALLY those on the frontline in the pandemic, do not get £m contracts, donor bungs, expenses, guaranteed huge pay rises, and lucrative second jobs. WE will NOT tolerate pay freezes while the rich get richer. Repeat NOT. Resist",Pay Rises,5.501424105,1.843830656,0.746588111,positive,"Nov 20, 2020",Reposts,0,0,0,0,Male,261
", , , Your electric car does as much or more damage to the environment than an efficient ICE The only climate catastrophe is the one hitting the elderly on low fixed incomes, who can no longer afford to heat their homes as energy prices are raised through ‘green’ subsidies",Cost of Living,1.846394278,5.643657835,-1.463871299,negative,"Apr 20, 2021",Replies,0,0,0,0,Male,257
", TAX THE RICH! If someone can not afford to pay out more for NI how will they find money to pay a private insurance company? Will you people please get real!! Poor people are living in poverty with no way out. We are a rich country with food banks FFS! Again  TAX THE RICH!",Rich People,5.453477093,3.24946592,0.171189163,neutral,"Sep 15, 2021",Reposts,0,0,0,0,Female,256
", , Lost in real terms  undeniable that living standards have increased for the majority since 80s, but we have started seeing a steady decline in living standards over the past half decade as a result of poor wages, 0 hour jobs,public sector pay freezes alongside cuts to welfare",Public Sector Pay,4.337320963,4.488366262,-0.380805496,negative,"Dec 29, 2020",Replies,0,0,0,0,Unknown,251
", Absolutely right, and for this we need a care plan that includes prevention as much as fixing illhealth. But today's debate, wrongly or rightly, is about paying for it and NI rises are BungForBoomers and not a fair payment plan. This proposal undermines necessary reform",Social Care,3.738714281,2.5391461,0.040340343,neutral,"Sep 7, 2021",Replies,0,0,0,0,Unknown,218
