body,clusters_0,sentiment_positive_score,sentiment_negative_score,sentiment_combined_score,sentiment_summary,published_date,post_type,total_engagement,comments,shares,likes,author_gender,followers
", , , Quite sad, she lost her title although William promised to return it when he was king. 17mil settlement and a 300k+ annual “wage” not a bad divorce. The Queen didn’t mind her keeping the title, but Charles did, as it was humiliating for her. No longer having status, and having...",Poor Pay,1.725516284,6.220368838,-1.628876493,negative,"Mar 8, 2021",Replies,0,0,0,0,Male,7809
", , Not much and so is inflation (and taxes). Wage rises without productivity will stuff the economy. You’re trying to argue from one extreme outlier in one sector. What will happen is: the jobs will go abroad. Happening already.",Pay Rises,1.490714887,4.64071708,-1.482186693,negative,"Oct 3, 2021",Replies,0,0,0,0,Unknown,7489
", , , Inflation and the cost of living has increased dramatically due to Brexit. I believe the minimum wage for 2022/3 will be set this month. It will be interesting to see what it will be. Keep in mind that BorisJohnson is now robbing pensioners of the triple lock.",Minimum Wage Increase,4.100591683,1.538661899,0.633644544,positive,"Sep 7, 2021",Reposts,0,0,0,0,Male,6696
", , , , , , , , , , Why insecurity of hours is such a big issue for lowpaid workers. More than oneinthree are anxious about unexpected changes to hours of work. It will take more than a higher minimum wage to improve work for lowpaid staff. Stronger rights and more agency for workers needed. ,",Minimum Wage Increase,2.797657138,2.899954951,-0.382486462,negative,"Jun 8, 2021",Reposts,0,0,0,0,Male,6465
"Lack of funding is not sustainable for a health service we want to keep, poor pay and unsafe staffing only leads to poor patient care. I don’t want to deliver poor patient care on low pay with an increased workload due to staffing. Pay us properly NHSPay15 THX , ,",Social Care,5.736048202,2.821828917,0.362811689,positive,"Feb 6, 2021",Reposts,0,0,0,0,Unknown,5957
", , , , , , , , , , , , , , , , , , , , , , , , , , , , , , , , , Inadequate untrained staff, probably on minimum wage. They seem to employ anybody for these jobs & the low wages don't help the fact that these people don't seem to take their jobs seriously. Managers are usually a waste of time. Sounds like good advice from from medics though.",Minimum Wage Increase,3.0269297,3.358162075,-0.450418608,negative,"Feb 3, 2021",Reposts,0,0,0,0,Unknown,5694
", , Might have some credibility if they hadn't just slashed the international aid budget to give loads of dosh to their mates in dodgy contracts. They just don't like paying tax to help people who are poorer than them. We are not in it together.",Rich People,5.687200594,3.562999081,0.121041921,neutral,"Dec 18, 2020",Replies,0,0,0,0,Female,5607
", Why ""destroy"" these poor animals? Why not let them live? If the farmer's don't want to pay to feed them, they should be in another kind of farming — try fruit and vegetables.",Government Support,1.788857864,5.626396911,-1.492465496,negative,"Oct 9, 2021",Reposts,0,0,0,0,Male,5461
", , , A space race is NOT a good example. Space does NOT ""represent hope for so many people."" Many people need a home, food, clean water. If you rich ones paid your way for the infrastructure you use here on Earth, poorer people cd have the basic necessities of life instead of being 1/",Rich People,2.891547309,3.540250574,-0.548979339,negative,"Jul 15, 2021",Replies,0,0,0,0,Female,5267
", , , , , , , , , , , , , , , , @0Sundance , , , , , , , , , , , , , , , , , , @300cba , , , , , , , , , , , , , , You will end up losing this battle by paying more for electricity. The poor will lose even bigger, funny how liberals claim they want to help the poor, but everything they do hurts them.",Poor Pay,4.866780541,2.638727663,0.265562193,neutral,"Apr 7, 2021",Reposts,0,0,0,0,Male,4780
... bad credit makes you pay even more for stuff over and above it’s actual value. It’s a system that locks in poverty and is proof that social mobility is a myth. It also doesn’t work on its own terms. The article references a study A in Baltimore which found that... 7/,Government Support,3.638085188,3.687416069,-0.360042055,negative,"Jun 7, 2021",Replies,0,0,0,0,Male,4730
"I’m not happy about the increase in corporation tax or the freezing of income tax thresholds, but we have to pay for the billions pumped into NHS and furlough scheme somehow. Sunak has an impossible job, so he’s done as well as anyone could reasonably hope to expect.",Job,3.14736428,3.516498069,-0.457473852,negative,"Mar 3, 2021",Reposts,0,0,0,0,Unknown,4624
"Ultimately the UK's answer to Climate problems... Will not be to stop.. drilling for gas, using coal, HS2, cutting tax on air flights, making promises it's not going to keep... but increasing tax on the poorest people.. a climate levy to pay to mates who will do fuck all... wait",State Pension,2.795653285,2.992244175,-0.414531444,negative,"Nov 3, 2021",Reposts,0,0,0,0,Unknown,4427
"'But Pete,' I hear you say, 'doesn't it display a stagnant overpopulated earth in which your cherished l/acc basic income has solidified cosmic class divides? Doesn't it portray a Red Mars whose technocommunist dream is unravelling? Isn't all this a bit antil/acc?' Fuck no.",Low Income Families,5.035782849,3.533156595,0.007803714,neutral,"Jan 12, 2021",Replies,0,0,0,0,Male,4386
"MSPs won't receive a pay rise next year. Pay freeze has been agreed by Scottish Parliamentary Corporate Body, with PO Ken Macintosh saying increasing MSPs' salaries in the middle of the pandemic wouldn't be appropriate.",Mental Health,2.981429773,3.687661312,-0.559163082,negative,"Dec 4, 2020",Reposts,0,0,0,0,Male,3987
"The decision to end the £20 uplift to UC in October will ensure the UK’s poorest families see their income fall just as unemployment rises, and leave the basic level of unemployment benefit at its lowest level since the early 1990s. ,",Government Support,6.902256528,1.538661899,1.154361659,positive,"Mar 3, 2021",Reposts,0,0,0,0,Male,3971
NeverVoteConservative Billions given to firms with offices overseas to avoid UK tax Billions on corruption and failure 37 billion failed test and trace Billions lost because Tories refused to go for zero covid Your tax rises through austerity 2 will pay it back,State Pension,2.132700223,5.478782992,-1.290067698,negative,"May 3, 2021",Reposts,0,0,0,0,Female,3899
", , ‘Wealth tax’ is bad communication. The Tories love it because they will use it to terrify anyone with a few grand in the bank achieved through hard saving. Tax if then spent properly is an investment. Link tax to solutions & improvements & people understand the need to pay.",Income Tax,5.439498609,2.931919626,0.271455928,neutral,"Sep 7, 2021",Replies,0,0,0,0,Unknown,3320
"As highlighted by ,, our paper shows that reducing income support via the Benefit Cap increased selfreported depression and anxiety. Check out the full research article (open access) at , (coauthors , , ,)",Mental Health,4.126068079,2.208222872,0.278563263,neutral,"Oct 4, 2021",Reposts,0,0,0,0,Female,3292
"Reminder that we are looking for $2 billion to build a rail line in a war zone. If we even find anyone to lend us that money, how will Nigeria pay back? You can't approve such an expensive project and do nothing about Bandits in the area. How did we mess up this bad?",Leaseholding,3.0269297,3.932263618,-0.608240029,negative,"Nov 24, 2020",Reposts,0,0,0,0,Unknown,3181
", Sick / disabled / low income homeowners with mortgage had SMI Benefit removed. The Gov. loan interest upon interest upon mortgage debt is wrong. Most refused Gov loan. But SMI never paid enough and much lower than Housing Benefits which pays landlords' mortgages.",Low Income Families,3.183324539,2.244183131,0.00301092,neutral,"Mar 17, 2021",Reposts,0,0,0,0,Unknown,2854
", , This should be headline news. Students who already carry the weight of huge loans with toohigh interest rates must start paying them back when on lower wages than before.This is vile , tax your rich mates instead, shame on you.",Rich People,2.478469122,2.482585843,-0.348233206,negative,"Sep 27, 2021",Reposts,0,0,0,0,Female,2747
Staff Ts and Cs like Agenda for Change are national (just about stillwatch for ICS and the NHS Bill breaking up national pay bargaining). Poor pay is national. Nothing to do with the employer. The fight for NHSPay15 is national,National Insurance,4.193479927,4.488366262,-0.414531444,negative,"Sep 29, 2021",Reposts,0,0,0,0,Unknown,2412
"US job growth slow NOT because of workers' extra unemployment compensation. Rather employers offer low wages so higher profits offset 2020 losses. Workers resist: refuse lowwage jobs; that's the ""labor shortage."" WeCanDoBetterThanCapitalism ,",Poor Pay,2.168660482,4.388596286,-1.051473326,negative,"Jun 10, 2021",Reposts,0,0,0,0,Unknown,2155
", But you are not a socialist, labour were created to protect the British working class, socialism doesn’t support mass migration, in England its increased house prices, forced a generation into rental, suppressed wages crippling infrastructure, NHS, GPS, 12m since 1998 in England,",House Prices,3.412320356,5.277455326,-0.78262511,negative,"May 8, 2021",Reposts,0,0,0,0,Unknown,2051
"Once enough of our NHS is handed over to US healthcare companies YOU will have to have 1. Comprehensive Insurance 2. Loads of money 3. Excellent health I write about the 1860s ~ the poor died like flies, in agony, from curable illnesses. The rich paid for treatment BorisOut ,",National Insurance,4.674408937,2.523683282,0.26980968,neutral,"May 12, 2021",Reposts,0,0,0,0,Male,1982
", The problem with taxing the super rich is that they have the money to leave UK and go somewhere that won't tax them. People will have pay more tax, number claiming state pension is going double over next 17 years. Number of over 90s to increase from 605k to 11m over 17 years",State Pension,3.354783942,3.590693009,-0.414531444,negative,"Sep 14, 2021",Replies,0,0,0,0,Male,1867
"Important to understand that rents rise much faster than the average wage, not just the minimum wage fiat. / Rising rents will eventually lead to financial collapse and social chaos. Spoiler alert: Capitalists know this, but as they are insulated from consequence, don't care.",Social Care,2.262839288,3.358162075,-0.741347066,negative,"Feb 25, 2021",Reposts,0,0,0,0,Male,1850
"""After 12 long months struggling to cope with job losses, pay cuts and rising costs, families with children have been among the hardest hit by the pandemic and unless the Government chooses to protect them now, many face financial insecurity or poverty for years to come"" ,",Job,1.846394278,6.906681228,-1.665828129,negative,"Jun 23, 2021",Reposts,0,0,0,0,Unknown,1848
", , I’d ask how the FUCK they are trying to…blame McDonalds’ wages for the rising costs of daycare…?!? but I suspect the answer will be something that makes me want to stab myself in the eye if it’s not just a “entitled person throws random things at the wall”.",House Prices,2.795653285,5.851461714,-1.085199273,negative,"Oct 15, 2021",Replies,0,0,0,0,Unknown,1757
", , Typical Tories, don't even pay their bills on time. We used to find this in 'real life'. Poor people on the other hand cash ready.",Poor People,5.783094618,3.687661312,0.103372884,neutral,"Sep 12, 2021",Replies,0,0,0,0,Male,1538
"Combined with the NationalInsurance unfair tax hike this cuts lowest paid incomes by £1300 a year. It's wrong, and , should finally stand up for what's right and protect Watford's most in need. Oppose cutting UniversalCredit tomorrow, call for review of tax change.",Low Income Families,1.551054707,4.751279593,-1.466052404,negative,"Sep 15, 2021",Reposts,0,0,0,0,Unknown,1526
", , Seeing all the good advice and hope she is encouraged by it  why is it that those who have the highest intentions to pay their share of tax are those with lowest incomes and vice versa? Good luck to her  I was worried about handling tax from training for fees but it was easy",Leaseholding,5.736048202,1.73781009,0.847571165,positive,"Jun 11, 2021",Replies,0,0,0,0,Male,1499
"Once enough of our NHS is handed over to US healthcare companies YOU will have to have 1. Comprehensive Insurance 2. Loads of money 3. Excellent health I write about the 1860s ~ the poor died like flies, in agony, from curable illnesses. The rich paid for treatment BorisOut",National Insurance,4.674408937,2.523683282,0.26980968,neutral,"May 12, 2021",Reposts,0,0,0,0,Female,1481
", , , I work in a highly skilled job and have a BSc and 30 years experience in a field that I consider worthwhile. Nurse’s pay has been unfairly low for a long time. It is not reasonable to suggest that highly skilled workers “just leave” when they’re arguing for a decent wage.",Job,4.601504352,3.103400789,0.047311154,neutral,"Mar 7, 2021",Replies,0,0,0,0,Female,1472
", , Nursing pay has drifted down for about ten years. This has left English NHS with over 40k nursing vacancies. Nursing vacancies are extremely bad news for patient safety. They need a market incentive now. Nursing pay needs to be competitive if we want safe care.",Social Care,3.699580745,2.899954951,-0.103049292,neutral,"Mar 5, 2021",Reposts,0,0,0,0,Male,1459
", Whilst the likes of twickets restrict the resale of tickets with unfair terms and conditions only to sell platinum priced tickets for the acts they manage such as Little Mix and JLS. Very fair for consumers, not. Force them to pay high, then sell low and not below face. Flawed.",Income Tax,1.153996424,4.388596286,-1.682351944,negative,"Jul 9, 2021",Replies,0,0,0,0,Unknown,1403
", The tories actively want more poor people. That means it could be you next. Its their policy. More poor and desperate people means lower wages and higher profits. Don't punch down on those on less than you. Get the Tories out and build a fair society.",Low Income Families,5.275645672,0.993809924,1.322736797,positive,"Mar 6, 2021",Replies,0,0,0,0,Male,1399
", , , , , , I agree that we should be buying more home produced but exports are essential. There has been an increasing amount circulating over the past few years and there is huge pent up demand ready to spend as soon as we are allowed. I don’t support wage stagnation in the long term.",Government Support,4.112585709,1.73781009,0.514852615,positive,"Mar 7, 2021",Replies,0,0,0,0,Unknown,1390
"Moreover, over 400,000 lowincome private renting households in the North and Midlands are currently paying rents they cannot afford. The solution has to be a better tenure mix for new builds, with the delivery of more social rent homes in particular.",Low Income Families,2.23607233,2.765745984,-0.559163082,negative,"Oct 6, 2021",Replies,0,0,0,0,Male,1336
"Is universal basic income the answer? ,'s , explains how a temporary basic income can help the world’s poorest people and slow the surge in COVID19 by enabling close to 3 billion people to stay at home. More via ,. ,",Government Support,7.075835947,1.318853056,1.333349539,positive,"Dec 31, 2020",Reposts,0,0,0,0,Unknown,1276
"I refereed a , game at Eastern Leisure Centre this morning. All 3 pitches need major attention. Poor pitch markings, no penalty spots, overhanging trees & a very clear lack of grass cutting. Teams like , deserve a better return on what they pay. ,",Low Income Families,4.895422701,0.993809924,1.247936349,positive,"Aug 29, 2021",Reposts,0,0,0,0,Male,1274
"They really used the promise of a $15 minimum wage to appease us, when in fact, that wouldn't get u anywhere nowadays. That's barely, if at all enough to make ends meet. Then there's the threat of an unexpected expense that could be catastrophic for some, rising food costs, etc.",Minimum Wage Increase,1.706160178,3.510877028,-1.068194126,negative,"Sep 23, 2021",Reposts,0,0,0,0,Unknown,1256
", , A union boss that upsets capitalists is a very good sign. We've all had enough of excessive salaries at the top and real term pay cuts at the bottom. And we all know now that many of the low paid workers are absolutely key to the functioning of the economy.",Poor Pay,2.546659632,1.766578297,0.019164451,neutral,"Aug 30, 2021",Reposts,0,0,0,0,Female,1185
"IFS says millions of us will be worse off in 2022 amid rising costs, higher taxes, negating small wage increases, & lowincome families will feel ""real pain"" as the cost of living is set to increase faster than benefit payments. Even Sunak admits families are already under strain ,",Low Income Families,3.699580745,3.869009801,-0.391352698,negative,"Oct 28, 2021",Reposts,0,0,0,0,Female,1185
", Don’t forget that in the middle of the pandemic, Johnson increased defence spending in real terms and Labour said well done Some time after, Johnson refused to award nurses a reasonable pay increase. The BBC and other broadcasters chose not to highlight the defence spending☹️",Poor Pay,5.597318129,3.187134804,0.216591655,neutral,"May 19, 2021",Replies,0,0,0,0,Male,1110
I know labour has a problematic history with austerity so I’ll explain:  cutting public services overwhelmingly relied upon by poor people and minorities = austerity  modest tax rise on business profits that has the effect of reducing income inequality = not bloody austerity,Mental Health,3.187469512,3.837045127,-0.532048817,negative,"Mar 1, 2021",Reposts,0,0,0,0,Male,1059
"“If a person does not pay their fine and is prosecuted, then they risk getting a criminal record. That means the poorest have been the ones most likely to be criminalised. No doubt many unlawfully issued fines have been paid as well” ,",Income Tax,3.145915435,2.931919626,-0.276126037,neutral,"May 3, 2021",Reposts,0,0,0,0,Male,1006
", Bcos they despise people who are ina lower income bracket or social clique, seeing it as the natural order of life, imho, they also believe that poor people are poor because of personal deficiency & deserve no mercy because they choose to be lazy, The Myth of the Undeserving Poor",Poor People,1.895733531,5.937046589,-1.488179541,negative,"Nov 10, 2020",Replies,0,0,0,0,Female,964
"However, access to cheap credit led to high levels of public debt. Kaminsky notes that this led to a decrease in economic growth, which causes the financial crisis as countries were unable to pay back their debts LSEPostCOVID",Wage Growth,1.538661899,4.44582645,-1.407626228,negative,"Nov 2, 2021",Replies,0,0,0,0,Male,955
", , Basically yes, but I would prefer a flat median wage support. The v poor get more than normal, so you give more support to those at most risk of harm whilst the richer half of the population get a taste of what it's like for the other half. Of course most of them won""t need it!",Government Support,3.455723096,0.638877809,1.3415002,positive,"Feb 6, 2021",Reposts,0,0,0,0,Unknown,945
", , If minimum wage goes up to £15 then ALL wages will need to increase or you are devaluing the work of more skilled jobs. Then the employers have to foot the bill. This will lead to people suffering shrinking wages due to increased costs. , working hard to shrink wages.",Minimum Wage Increase,4.148538695,2.944297162,-0.003687574,neutral,"Sep 28, 2021",Replies,0,0,0,0,Unknown,930
", Agreed. When approximately £2.6bn of the rise is to protect the assets of people who generally don't pay NIC, it does not seem progressive. Surely the wealth distribution is more important than income distribution in this debate.",Income Tax,5.875122442,1.580426277,0.966458705,positive,"Sep 9, 2021",Replies,0,0,0,0,Male,883
"6/ So it's not corruption  except in the moral sense  that leeches most of the value of the food away from the poor families who have to live on it... it's ""operating costs""... the CSR department, the glossy annual report, the lobbying, exec salaries etc...",Low Income Families,5.122169604,1.277755617,1.041899395,positive,"Jan 12, 2021",Reposts,0,0,0,0,Unknown,827
", , , , Capitalist Greed Wants Unthinking Workers Who Accept Low Pay And Lousy Conditions Like In The Time Of Black Human Slavery. These Wealthy Greedy Selfish Vermin Actually Expect You To Be Grateful For Being Sh*T Upon.",Poor Pay,3.111404021,4.280715508,-0.665619683,negative,"Aug 11, 2021",Replies,0,0,0,0,Male,827
", So privileged I am, working and entry level job with a wage increase freeze. Cannot afford a mortgage or bills despite spending most of my week working. Such privilege.",Job,2.396274244,2.785256503,-0.496998428,negative,"Aug 20, 2021",Reposts,0,0,0,0,Unknown,815
", , , , , We never lost 'sovereignty' you absolute cock. It was a Brexiteer/billionaire libertarian lie to fool low intelligence ppl like you. Now they can roll back worker rights, privatise the NHS and pay fuck all tax. Read the 'sovereign individual' yet? You voted 2 fuck your community",Poor Pay,4.959352051,1.9309001,0.59671524,positive,"Aug 17, 2021",Replies,0,0,0,0,Male,772
"This is utterly disgraceful. Workers in some of our biggest supermarkets are forced to rely on benefits just to survive, due to criminally low wages. We need a RealLivingWage NOW ✊🌹🐝🚩 , , , , ,",Mental Health,2.891547309,4.349932426,-0.754942141,negative,"Oct 15, 2021",Reposts,0,0,0,0,Female,739
", , , Bang right. Few of us can give our kids the things millionaires can but love is constant and breeds good people, it's not wealth or status which is important and wellpaid Social Workers deciding poor people are 'neglecting' their offspring is an evil.",Leaseholding,4.715506376,2.482585843,0.294982021,neutral,"Jul 5, 2021",Replies,0,0,0,0,Unknown,725
"Cost of living will also eat into the real benefit of the pay rise, THOUGH the , finds average wages are rising above inflation (""real terms"". HMT could do more through fuel tax relief to cut energy costs this winter. 2/",House Prices,5.140732137,1.153996424,1.147390849,positive,"Oct 26, 2021",Replies,0,0,0,0,Male,715
"Lack of funding is not sustainable for a health service we want to keep, poor pay and unsafe staffing only leads to poor patient care. I don’t want to deliver poor patient care on low pay with an increased workload due to staffing. Pay us properly NHSPay15 THX ,",Social Care,5.736048202,2.821828917,0.362811689,positive,"Feb 11, 2021",Reposts,0,0,0,0,Female,702
", , , we were having a long Twitter chat about this. Can't believe how many are being duped by Sunak. Even no.1 neolib economy: US sends stimulus checks direct to people (one off UBI?) Furlough is generous, but paid to corp. employees. Poor will pay. Very Bad decision.",Long Hours,2.765692463,2.867990276,-0.38289408,negative,"Jan 6, 2021",Replies,0,0,0,0,Female,702
", , , , , I’ve already mentioned the in work poverty group contains the highest number of poor people. Why do those people need to claim benefits? The U.K. min wage isn’t even in the top 5 in NW Europe and our benefits system is nowhere near the most generous. You’re parroting Tory lies.",Poor People,4.141353917,1.73781009,0.521823425,positive,"Jun 29, 2021",Replies,0,0,0,0,Unknown,661
", "", want to say a huge thank you by freezing tax allowances, increasing your NI by 1.25%, increasing the NHS's NI bill by 1.25%, forcing consultants to cut hours or retire to avoid huge pension tax bills and slashing temporary staff pay by 25% with IR35"" Thanks Saj",State Pension,2.096739964,4.388596286,-1.085199273,negative,"Sep 9, 2021",Replies,0,0,0,0,Unknown,645
"EXCLUSIVE: Bus drivers have risked their lives on the pandemic's frontline  but are still battling against poor protection, pay cuts, unsafe working practices and sparse toilet facilities. Here they describe having to work with Covid 👇 , via ,",Mental Health,2.891547309,4.44582645,-0.77674761,negative,"Jan 11, 2021",Reposts,0,0,0,0,Male,631
", Which is not the same as saying eat out to help out, prioritise profit, or rush back to the office (I'm at home), but any benefits of this are a long way off and many lower and middle income people will never recover from the experience of 2020/21.",Low Income Families,5.916219881,2.785256503,0.40678415,positive,"Feb 3, 2021",Replies,0,0,0,0,Male,606
"Banning employees from working in more than one care home without guaranteeing wages will plunge thousands of lowincome families into poverty, trigger staff shortages and put residents at risk, says , today ,",Low Income Families,4.265400445,4.87419888,-0.479993281,negative,"Dec 4, 2020",Reposts,0,0,0,0,Unknown,583
", , IFS says millions of us will be worse off in 2022 amid rising costs, higher taxes, negating small wage increases, & lowincome families will feel ""real pain"" as the cost of living is set to increase faster than benefit payments. Even Sunak admits families are already under strain",Low Income Families,3.699580745,3.869009801,-0.391352698,negative,"Nov 3, 2021",Reposts,0,0,0,0,Male,569
", , When termination is not accessible legally and openly, rich women will travel elsewhere and pay for help. Poor women just end up dead. Terminations and the reasons for them don't magically stop.",Rich People,5.035782849,3.956895518,-0.105464353,neutral,"Sep 1, 2021",Replies,0,0,0,0,Unknown,554
"A 1% pay rise for NHS nurses will cost well under £100M. The government have committed £22B to the largely ineffective track and trace service. The nurses pay rise will cost less than 0.5% of the money wasted on TandT. I will just let that sink in...... ,",Poor Pay,4.674408937,2.564780721,0.253656148,neutral,"Mar 5, 2021",Reposts,0,0,0,0,Male,550
", They haven't been paid for this. The burden of proof shouldn't lie with them. The poor woman felt suicidal and wasn't allowed to get the help she needed. bekind",Government Support,3.428318857,3.24946592,-0.292994229,neutral,"Mar 8, 2021",Replies,0,0,0,0,Male,529
